{
  "schema_version": "2.0",
  "tool": "resqmonitor",
  "dataset": "Synthetic ticket classification",
  "evaluated_at": "2026-10-13T12:00:00+00:00",
  "synthetic": true,
  "status": "unknown",
  "decision": {
    "outcome": "undetermined",
    "scope": "supplied_observations",
    "required_checks": [
      "accuracy",
      "outcome_coverage",
      "confidence_alignment",
      "cost_per_correct",
      "latency",
      "baseline_accuracy",
      "case_mix"
    ],
    "action_authorized": false
  },
  "policy": {
    "dataset_name": "Synthetic ticket classification",
    "id_column": "record_id",
    "prediction_column": "predicted_label",
    "outcome_column": "actual_label",
    "confidence_column": "confidence",
    "cost_column": "cost",
    "latency_column": "latency_ms",
    "group_column": "group",
    "cost_unit": "EUR",
    "min_evaluated_rows": 30,
    "min_accuracy_pct": 85,
    "accuracy_threshold_basis": "point_estimate",
    "evidence_context": {
      "purpose": "Illustrate declared acceptance criteria with synthetic observations.",
      "population": "Bundled synthetic examples only.",
      "sampling_method": "Constructed fixtures; not a random or production sample.",
      "reference_basis": "Constructed reference labels; no independent real-world adjudication."
    },
    "min_outcome_coverage_pct": 90,
    "max_confidence_gap_pp": 10,
    "allowed_accuracy_drop_pp": 10,
    "max_case_mix_shift_pct": 20,
    "max_cost_per_correct": 0.05,
    "max_mean_latency_ms": 300
  },
  "provenance": {
    "input_sha256": {
      "current": "d310aaead313448c87bb48090a997cc455bd84f2230c52725423ccf45f6e06fd",
      "baseline": "9120458a522c5b797a3e61e3f237c6b45977c21681013c0452b244b5630a91fc"
    },
    "policy_sha256": "736f99008cdac77c9c6a04873439456bfc3ec359de9749e2a08d9da14c5a266f",
    "source_verification": "not_performed",
    "context_verification": "not_performed",
    "generalization": "not_assessed"
  },
  "summary": {
    "rows": 0,
    "evaluated_rows": 0,
    "correct_rows": 0,
    "pending_rows": 0,
    "invalid_rows": 0,
    "duplicate_id_rows": 0,
    "accuracy_pct": null,
    "outcome_coverage_pct": null,
    "accuracy_wilson_95_pct": null
  },
  "checks": {
    "accuracy": {
      "label": "Observed accuracy",
      "status": "unknown",
      "value": null,
      "unit": "%",
      "message": "Exact label matches among supplied reference outcomes. Count, outcome coverage and valid records govern the verdict.",
      "evidence": {
        "correct_rows": 0,
        "evaluated_rows": 0,
        "minimum_evaluated_rows": 30,
        "wilson_95_interval_pct": null,
        "outcome_coverage_pct": null,
        "minimum_outcome_coverage_pct": 90,
        "interval_assumptions": "independent_binomial_sample_not_verified",
        "minimum_accuracy_pct": 85
      },
      "threshold_status": "unknown",
      "evidence_status": "missing",
      "reason_codes": [
        "NO_OBSERVATIONS"
      ],
      "threshold": {
        "minimum": 85,
        "maximum": null,
        "basis": "point_estimate",
        "assessment_value": null
      }
    },
    "outcome_coverage": {
      "label": "Outcome coverage",
      "status": "unknown",
      "value": null,
      "unit": "%",
      "message": "Valid completed outcomes divided by all supplied rows, including pending and invalid rows.",
      "evidence": {
        "evaluated_rows": 0,
        "all_rows": 0,
        "pending_rows": 0,
        "invalid_rows": 0,
        "minimum_pct": 90
      },
      "threshold_status": "unknown",
      "evidence_status": "missing",
      "reason_codes": [
        "NO_OBSERVATIONS"
      ],
      "threshold": {
        "minimum": 90,
        "maximum": null,
        "basis": "point_estimate",
        "assessment_value": null
      }
    },
    "confidence_alignment": {
      "label": "Confidence alignment",
      "status": "unknown",
      "value": null,
      "unit": "pp",
      "message": "Absolute gap between mean reported confidence and accuracy on paired rows; this is a warning heuristic.",
      "evidence": {
        "paired_rows": 0,
        "mean_confidence_pct": null,
        "paired_accuracy_pct": null,
        "maximum_gap_pp": 10,
        "minimum_paired_rows": 30
      },
      "threshold_status": "unknown",
      "evidence_status": "missing",
      "reason_codes": [
        "NO_OBSERVATIONS"
      ],
      "threshold": {
        "minimum": null,
        "maximum": 10,
        "basis": "point_estimate",
        "assessment_value": null
      }
    },
    "cost_per_correct": {
      "label": "Cost per correct result",
      "status": "unknown",
      "value": null,
      "unit": "EUR",
      "message": "Total cost of supplied classification outputs divided by correct outcomes. Incomplete or zero-success samples are unknown.",
      "evidence": {
        "cost_rows": 0,
        "all_rows": 0,
        "correct_rows": 0,
        "known_total_cost": null,
        "cost_unit": "EUR",
        "maximum": 0.05,
        "all_outcomes_complete": false
      },
      "threshold_status": "unknown",
      "evidence_status": "missing",
      "reason_codes": [
        "NO_OBSERVATIONS"
      ],
      "threshold": {
        "minimum": null,
        "maximum": 0.05,
        "basis": "point_estimate",
        "assessment_value": null
      }
    },
    "latency": {
      "label": "Mean latency",
      "status": "unknown",
      "value": null,
      "unit": "ms",
      "message": "Mean and nearest-rank p95 over instrumented rows; incomplete latency coverage keeps the verdict unknown.",
      "evidence": {
        "latency_rows": 0,
        "all_rows": 0,
        "p95_ms": null,
        "maximum_mean_ms": 300
      },
      "threshold_status": "unknown",
      "evidence_status": "missing",
      "reason_codes": [
        "NO_OBSERVATIONS"
      ],
      "threshold": {
        "minimum": null,
        "maximum": 300,
        "basis": "point_estimate",
        "assessment_value": null
      }
    },
    "baseline_accuracy": {
      "label": "Accuracy change from baseline",
      "status": "unknown",
      "value": null,
      "unit": "pp",
      "message": "Current minus baseline accuracy. Samples and outcome coverage must meet their minimums; this is descriptive, not causal.",
      "evidence": {
        "current_accuracy_pct": null,
        "baseline_accuracy_pct": 90.0,
        "current_evaluated_rows": 0,
        "baseline_evaluated_rows": 40,
        "allowed_drop_pp": 10
      },
      "threshold_status": "unknown",
      "evidence_status": "insufficient",
      "reason_codes": [
        "COMPARISON_GUARDRAILS_NOT_MET"
      ],
      "threshold": {
        "minimum": -10,
        "maximum": null,
        "basis": "point_estimate",
        "assessment_value": null
      }
    },
    "case_mix": {
      "label": "Case mix shift",
      "status": "unknown",
      "value": null,
      "unit": "%",
      "message": "Total variation in supplied group shares. Changed case mix may affect accuracy comparisons.",
      "evidence": {
        "current_groups": {
          "observed": true,
          "missing_group_rows": 0,
          "groups": []
        },
        "baseline_groups": {
          "observed": true,
          "missing_group_rows": 0,
          "groups": [
            {
              "group": "business",
              "rows": 20,
              "evaluated_rows": 20,
              "correct_rows": 16,
              "accuracy_pct": 80.0,
              "enough_evidence": false
            },
            {
              "group": "consumer",
              "rows": 20,
              "evaluated_rows": 20,
              "correct_rows": 20,
              "accuracy_pct": 100.0,
              "enough_evidence": false
            }
          ]
        },
        "maximum_shift_pct": 20
      },
      "threshold_status": "unknown",
      "evidence_status": "insufficient",
      "reason_codes": [
        "COMPARISON_GUARDRAILS_NOT_MET",
        "INCOMPLETE_GROUP_ASSIGNMENT"
      ],
      "threshold": {
        "minimum": null,
        "maximum": 20,
        "basis": "point_estimate",
        "assessment_value": null
      }
    }
  },
  "findings": [],
  "baseline_summary": {
    "rows": 40,
    "evaluated_rows": 40,
    "correct_rows": 36,
    "pending_rows": 0,
    "invalid_rows": 0,
    "duplicate_id_rows": 0,
    "accuracy_pct": 90.0,
    "outcome_coverage_pct": 100.0,
    "accuracy_wilson_95_pct": [
      76.94822477247772,
      96.04204713173937
    ]
  },
  "groups": {
    "observed": true,
    "missing_group_rows": 0,
    "groups": []
  },
  "notes": [
    "Overall status covers: accuracy, outcome_coverage, confidence_alignment, cost_per_correct, latency, baseline_accuracy, case_mix. Other diagnostics remain separately visible.",
    "Outcome labels are supplied evidence, not independently established ground truth.",
    "Evidence sufficiency means declared local guardrails are met; reference validity and generalization are not assessed.",
    "Input fingerprints identify supplied text; they do not authenticate its source or authorize agent actions.",
    "Exact-match classification metrics do not assess free-form text quality or safety.",
    "Sample-size limits and Wilson intervals do not establish representativeness or causal model regression.",
    "Group accuracies below the minimum evaluated count are descriptive only; check subgroup counts separately.",
    "Reports include aggregate counts, category/group names and record numbers, not IDs or raw rows.",
    "These records describe classification outputs. Account for retries upstream; no-output failures need separate workflow accounting."
  ],
  "scenario": "unknown"
}
